All logs will be stored in ./Logs
Job started on sc079 at Wed Nov 26 15:05:27 MST 2025
SLURM_JOB_ID: 40662244
[INFO] Using device: cpu
[INFO] Total mel files found: 73
[INFO] Usable (mel, label) pairs: 73
[INFO] Files total: 73
[INFO] Train files: 51
[INFO] Val files:   10
[INFO] Test files:  12
[INFO] Registered /scratch/sshuvo13/project_shared_folder_bspml_1/whole_dataset_features/male/mel_spectrum/00001558-100507.npy: 7420 segments, shape=(3, 64, 901)
[INFO] Registered /scratch/sshuvo13/project_shared_folder_bspml_1/whole_dataset_features/male/mel_spectrum/00001249-100507.npy: 5421 segments, shape=(3, 64, 901)
[INFO] Registered /scratch/sshuvo13/project_shared_folder_bspml_1/whole_dataset_features/male/mel_spectrum/00001579-100507.npy: 8155 segments, shape=(3, 64, 901)
[INFO] Registered /scratch/sshuvo13/project_shared_folder_bspml_1/whole_dataset_features/male/mel_spectrum/00001331-100507.npy: 4898 segments, shape=(3, 64, 901)
[INFO] Registered /scratch/sshuvo13/project_shared_folder_bspml_1/whole_dataset_features/male/mel_spectrum/00001086-100507.npy: 5207 segments, shape=(3, 64, 901)
[INFO] Registered /scratch/sshuvo13/project_shared_folder_bspml_1/whole_dataset_features/male/mel_spectrum/00001342-100507.npy: 4894 segments, shape=(3, 64, 901)
[INFO] Registered /scratch/sshuvo13/project_shared_folder_bspml_1/whole_dataset_features/male/mel_spectrum/00001224-100507.npy: 5170 segments, shape=(3, 64, 901)
[INFO] Registered /scratch/sshuvo13/project_shared_folder_bspml_1/whole_dataset_features/male/mel_spectrum/00001262-100507.npy: 4221 segments, shape=(3, 64, 901)
[INFO] Registered /scratch/sshuvo13/project_shared_folder_bspml_1/whole_dataset_features/male/mel_spectrum/00001508-100507.npy: 7040 segments, shape=(3, 64, 901)
[INFO] Registered /scratch/sshuvo13/project_shared_folder_bspml_1/whole_dataset_features/male/mel_spectrum/00001597-100507.npy: 7898 segments, shape=(3, 64, 901)
[INFO] Registered /scratch/sshuvo13/project_shared_folder_bspml_1/whole_dataset_features/male/mel_spectrum/00001182-100507.npy: 4669 segments, shape=(3, 64, 901)
[INFO] Registered /scratch/sshuvo13/project_shared_folder_bspml_1/whole_dataset_features/male/mel_spectrum/00001649-100507.npy: 6931 segments, shape=(3, 64, 901)
[INFO] Registered /scratch/sshuvo13/project_shared_folder_bspml_1/whole_dataset_features/male/mel_spectrum/00001673-100507.npy: 5882 segments, shape=(3, 64, 901)
[INFO] Registered /scratch/sshuvo13/project_shared_folder_bspml_1/whole_dataset_features/male/mel_spectrum/00001521-100507.npy: 7007 segments, shape=(3, 64, 901)
[INFO] Registered /scratch/sshuvo13/project_shared_folder_bspml_1/whole_dataset_features/male/mel_spectrum/00001449-100507.npy: 4834 segments, shape=(3, 64, 901)
[INFO] Registered /scratch/sshuvo13/project_shared_folder_bspml_1/whole_dataset_features/male/mel_spectrum/00001447-100507.npy: 5502 segments, shape=(3, 64, 901)
[INFO] Registered /scratch/sshuvo13/project_shared_folder_bspml_1/whole_dataset_features/male/mel_spectrum/00001498-100507.npy: 6807 segments, shape=(3, 64, 901)
[INFO] Registered /scratch/sshuvo13/project_shared_folder_bspml_1/whole_dataset_features/male/mel_spectrum/00001369-100507.npy: 7271 segments, shape=(3, 64, 901)
[INFO] Registered /scratch/sshuvo13/project_shared_folder_bspml_1/whole_dataset_features/male/mel_spectrum/00001658-100507.npy: 7312 segments, shape=(3, 64, 901)
[INFO] Registered /scratch/sshuvo13/project_shared_folder_bspml_1/whole_dataset_features/male/mel_spectrum/00001408-100507.npy: 4375 segments, shape=(3, 64, 901)
[INFO] Registered /scratch/sshuvo13/project_shared_folder_bspml_1/whole_dataset_features/male/mel_spectrum/00001549-100507.npy: 3603 segments, shape=(3, 64, 901)
[INFO] Registered /scratch/sshuvo13/project_shared_folder_bspml_1/whole_dataset_features/male/mel_spectrum/00001010-100507.npy: 4412 segments, shape=(3, 64, 901)
[INFO] Registered /scratch/sshuvo13/project_shared_folder_bspml_1/whole_dataset_features/male/mel_spectrum/00001656-100507.npy: 7143 segments, shape=(3, 64, 901)
[INFO] Registered /scratch/sshuvo13/project_shared_folder_bspml_1/whole_dataset_features/male/mel_spectrum/00001681-100507.npy: 5142 segments, shape=(3, 64, 901)
[INFO] Registered /scratch/sshuvo13/project_shared_folder_bspml_1/whole_dataset_features/male/mel_spectrum/00001412-100507.npy: 4825 segments, shape=(3, 64, 901)
[INFO] Registered /scratch/sshuvo13/project_shared_folder_bspml_1/whole_dataset_features/male/mel_spectrum/00001518-100507.npy: 6498 segments, shape=(3, 64, 901)
[INFO] Registered /scratch/sshuvo13/project_shared_folder_bspml_1/whole_dataset_features/male/mel_spectrum/00001295-100507.npy: 4848 segments, shape=(3, 64, 901)
[INFO] Registered /scratch/sshuvo13/project_shared_folder_bspml_1/whole_dataset_features/male/mel_spectrum/00001593-100507.npy: 8660 segments, shape=(3, 64, 901)
[INFO] Registered /scratch/sshuvo13/project_shared_folder_bspml_1/whole_dataset_features/male/mel_spectrum/00001318-100507.npy: 6260 segments, shape=(3, 64, 901)
[INFO] Registered /scratch/sshuvo13/project_shared_folder_bspml_1/whole_dataset_features/male/mel_spectrum/00001110-100507.npy: 5002 segments, shape=(3, 64, 901)
[INFO] Registered /scratch/sshuvo13/project_shared_folder_bspml_1/whole_dataset_features/male/mel_spectrum/00001256-100507.npy: 4904 segments, shape=(3, 64, 901)
[INFO] Registered /scratch/sshuvo13/project_shared_folder_bspml_1/whole_dataset_features/male/mel_spectrum/00001606-100507.npy: 4395 segments, shape=(3, 64, 901)
[INFO] Registered /scratch/sshuvo13/project_shared_folder_bspml_1/whole_dataset_features/male/mel_spectrum/00001276-100507.npy: 6312 segments, shape=(3, 64, 901)
[INFO] Registered /scratch/sshuvo13/project_shared_folder_bspml_1/whole_dataset_features/male/mel_spectrum/00001392-100507.npy: 6892 segments, shape=(3, 64, 901)
[INFO] Registered /scratch/sshuvo13/project_shared_folder_bspml_1/whole_dataset_features/male/mel_spectrum/00001301-100507.npy: 5888 segments, shape=(3, 64, 901)
[INFO] Registered /scratch/sshuvo13/project_shared_folder_bspml_1/whole_dataset_features/male/mel_spectrum/00001636-100507.npy: 4207 segments, shape=(3, 64, 901)
[INFO] Registered /scratch/sshuvo13/project_shared_folder_bspml_1/whole_dataset_features/male/mel_spectrum/00001043-100507.npy: 5103 segments, shape=(3, 64, 901)
[INFO] Registered /scratch/sshuvo13/project_shared_folder_bspml_1/whole_dataset_features/male/mel_spectrum/00001571-100507.npy: 3689 segments, shape=(3, 64, 901)
[INFO] Registered /scratch/sshuvo13/project_shared_folder_bspml_1/whole_dataset_features/male/mel_spectrum/00001629-100507.npy: 8934 segments, shape=(3, 64, 901)
[INFO] Registered /scratch/sshuvo13/project_shared_folder_bspml_1/whole_dataset_features/male/mel_spectrum/00001120-100507.npy: 5657 segments, shape=(3, 64, 901)
[INFO] Registered /scratch/sshuvo13/project_shared_folder_bspml_1/whole_dataset_features/male/mel_spectrum/00001575-100507.npy: 3864 segments, shape=(3, 64, 901)
[INFO] Registered /scratch/sshuvo13/project_shared_folder_bspml_1/whole_dataset_features/male/mel_spectrum/00001274-100507.npy: 5936 segments, shape=(3, 64, 901)
[INFO] Registered /scratch/sshuvo13/project_shared_folder_bspml_1/whole_dataset_features/male/mel_spectrum/00001324-100507.npy: 4639 segments, shape=(3, 64, 901)
[INFO] Registered /scratch/sshuvo13/project_shared_folder_bspml_1/whole_dataset_features/male/mel_spectrum/00001127-100507.npy: 5902 segments, shape=(3, 64, 901)
[INFO] Registered /scratch/sshuvo13/project_shared_folder_bspml_1/whole_dataset_features/male/mel_spectrum/00001006-100507.npy: 4770 segments, shape=(3, 64, 901)
[INFO] Registered /scratch/sshuvo13/project_shared_folder_bspml_1/whole_dataset_features/male/mel_spectrum/00001667-100507.npy: 4660 segments, shape=(3, 64, 901)
[INFO] Registered /scratch/sshuvo13/project_shared_folder_bspml_1/whole_dataset_features/male/mel_spectrum/00001396-100507.npy: 5193 segments, shape=(3, 64, 901)
[INFO] Registered /scratch/sshuvo13/project_shared_folder_bspml_1/whole_dataset_features/male/mel_spectrum/00001669-100507.npy: 5633 segments, shape=(3, 64, 901)
[INFO] Registered /scratch/sshuvo13/project_shared_folder_bspml_1/whole_dataset_features/male/mel_spectrum/00001616-100507.npy: 8570 segments, shape=(3, 64, 901)
[INFO] Registered /scratch/sshuvo13/project_shared_folder_bspml_1/whole_dataset_features/male/mel_spectrum/00001322-100507.npy: 4771 segments, shape=(3, 64, 901)
[INFO] Registered /scratch/sshuvo13/project_shared_folder_bspml_1/whole_dataset_features/male/mel_spectrum/00001382-100507.npy: 9165 segments, shape=(3, 64, 901)
[INFO] Total usable segments: 296391
[INFO] Found label classes: ['CentralApnea', 'CentralApnea;Hypopnea', 'CentralApnea;MixedApnea', 'Hypopnea', 'Hypopnea;ObstructiveApnea', 'MixedApnea', 'MixedApnea;Hypopnea', 'Normal', 'ObstructiveApnea', 'ObstructiveApnea;Hypopnea']
[INFO] Binary mapping:
       Normal -> 0
       CentralApnea -> 1 (event)
       CentralApnea;Hypopnea -> 1 (event)
       CentralApnea;MixedApnea -> 1 (event)
       Hypopnea -> 1 (event)
       Hypopnea;ObstructiveApnea -> 1 (event)
       MixedApnea -> 1 (event)
       MixedApnea;Hypopnea -> 1 (event)
       ObstructiveApnea -> 1 (event)
       ObstructiveApnea;Hypopnea -> 1 (event)
[INFO] Registered /scratch/sshuvo13/project_shared_folder_bspml_1/whole_dataset_features/male/mel_spectrum/00001463-100507.npy: 4500 segments, shape=(3, 64, 901)
[INFO] Registered /scratch/sshuvo13/project_shared_folder_bspml_1/whole_dataset_features/male/mel_spectrum/00001444-100507.npy: 3827 segments, shape=(3, 64, 901)
[INFO] Registered /scratch/sshuvo13/project_shared_folder_bspml_1/whole_dataset_features/male/mel_spectrum/00001488-100507.npy: 7080 segments, shape=(3, 64, 901)
[INFO] Registered /scratch/sshuvo13/project_shared_folder_bspml_1/whole_dataset_features/male/mel_spectrum/00001139-100507.npy: 5196 segments, shape=(3, 64, 901)
[INFO] Registered /scratch/sshuvo13/project_shared_folder_bspml_1/whole_dataset_features/male/mel_spectrum/00001677-100507.npy: 3524 segments, shape=(3, 64, 901)
[INFO] Registered /scratch/sshuvo13/project_shared_folder_bspml_1/whole_dataset_features/male/mel_spectrum/00001640-100507.npy: 4698 segments, shape=(3, 64, 901)
[INFO] Registered /scratch/sshuvo13/project_shared_folder_bspml_1/whole_dataset_features/male/mel_spectrum/00001400-100507.npy: 4991 segments, shape=(3, 64, 901)
[INFO] Registered /scratch/sshuvo13/project_shared_folder_bspml_1/whole_dataset_features/male/mel_spectrum/00001357-100507.npy: 3657 segments, shape=(3, 64, 901)
[INFO] Registered /scratch/sshuvo13/project_shared_folder_bspml_1/whole_dataset_features/male/mel_spectrum/00001701-100507.npy: 6838 segments, shape=(3, 64, 901)
[INFO] Registered /scratch/sshuvo13/project_shared_folder_bspml_1/whole_dataset_features/male/mel_spectrum/00001661-100507.npy: 3488 segments, shape=(3, 64, 901)
[INFO] Total usable segments: 47799
[INFO] Found label classes: ['CentralApnea', 'Hypopnea', 'MixedApnea', 'Normal', 'ObstructiveApnea']
[INFO] Binary mapping:
       Normal -> 0
       CentralApnea -> 1 (event)
       Hypopnea -> 1 (event)
       MixedApnea -> 1 (event)
       ObstructiveApnea -> 1 (event)
[INFO] Registered /scratch/sshuvo13/project_shared_folder_bspml_1/whole_dataset_features/male/mel_spectrum/00001041-100507.npy: 4998 segments, shape=(3, 64, 901)
[INFO] Registered /scratch/sshuvo13/project_shared_folder_bspml_1/whole_dataset_features/male/mel_spectrum/00001008-100507.npy: 5044 segments, shape=(3, 64, 901)
[INFO] Registered /scratch/sshuvo13/project_shared_folder_bspml_1/whole_dataset_features/male/mel_spectrum/00001028-100507.npy: 7360 segments, shape=(3, 64, 901)
[INFO] Registered /scratch/sshuvo13/project_shared_folder_bspml_1/whole_dataset_features/male/mel_spectrum/00001576-100507.npy: 4630 segments, shape=(3, 64, 901)
[INFO] Registered /scratch/sshuvo13/project_shared_folder_bspml_1/whole_dataset_features/male/mel_spectrum/00001131-100507.npy: 4726 segments, shape=(3, 64, 901)
[INFO] Registered /scratch/sshuvo13/project_shared_folder_bspml_1/whole_dataset_features/male/mel_spectrum/00001143-100507.npy: 5756 segments, shape=(3, 64, 901)
[INFO] Registered /scratch/sshuvo13/project_shared_folder_bspml_1/whole_dataset_features/male/mel_spectrum/00001245-100507.npy: 4848 segments, shape=(3, 64, 901)
[INFO] Registered /scratch/sshuvo13/project_shared_folder_bspml_1/whole_dataset_features/male/mel_spectrum/00001329-100507.npy: 5320 segments, shape=(3, 64, 901)
[INFO] Registered /scratch/sshuvo13/project_shared_folder_bspml_1/whole_dataset_features/male/mel_spectrum/00001355-100507.npy: 4908 segments, shape=(3, 64, 901)
[INFO] Registered /scratch/sshuvo13/project_shared_folder_bspml_1/whole_dataset_features/male/mel_spectrum/00001390-100507.npy: 4921 segments, shape=(3, 64, 901)
[INFO] Registered /scratch/sshuvo13/project_shared_folder_bspml_1/whole_dataset_features/male/mel_spectrum/00001018-100507.npy: 5088 segments, shape=(3, 64, 901)
[INFO] Registered /scratch/sshuvo13/project_shared_folder_bspml_1/whole_dataset_features/male/mel_spectrum/00001147-100507.npy: 7692 segments, shape=(3, 64, 901)
[INFO] Total usable segments: 65291
[INFO] Found label classes: ['CentralApnea', 'Hypopnea', 'MixedApnea', 'Normal', 'ObstructiveApnea']
[INFO] Binary mapping:
       Normal -> 0
       CentralApnea -> 1 (event)
       Hypopnea -> 1 (event)
       MixedApnea -> 1 (event)
       ObstructiveApnea -> 1 (event)
[INFO] Subsampling train set: 296391 -> 75000 segments.
[INFO] Train segments: 75000
[INFO] Val segments:   47799
[INFO] Test segments:  65291
[INFO] Train negatives (0): 240859
[INFO] Train positives (1): 55532
[INFO] pos_weight = 4.3373010156306275
[INFO] Model:
SleepApneaCNNFast(
  (block1): Sequential(
    (0): Conv2d(3, 16, kernel_size=(5, 5), stride=(1, 1), padding=(2, 2))
    (1): BatchNorm2d(16, eps=1e-05, momentum=0.1, affine=True, track_running_stats=True)
    (2): ReLU()
    (3): MaxPool2d(kernel_size=2, stride=2, padding=0, dilation=1, ceil_mode=False)
  )
  (block2): Sequential(
    (0): Conv2d(16, 32, kernel_size=(3, 3), stride=(1, 1), padding=(1, 1))
    (1): BatchNorm2d(32, eps=1e-05, momentum=0.1, affine=True, track_running_stats=True)
    (2): ReLU()
    (3): MaxPool2d(kernel_size=2, stride=2, padding=0, dilation=1, ceil_mode=False)
  )
  (block3): Sequential(
    (0): Conv2d(32, 64, kernel_size=(3, 3), stride=(1, 1), padding=(1, 1))
    (1): BatchNorm2d(64, eps=1e-05, momentum=0.1, affine=True, track_running_stats=True)
    (2): ReLU()
    (3): AdaptiveAvgPool2d(output_size=(1, 1))
  )
  (classifier): Sequential(
    (0): Flatten(start_dim=1, end_dim=-1)
    (1): Linear(in_features=64, out_features=32, bias=True)
    (2): ReLU()
    (3): Dropout(p=0.5, inplace=False)
    (4): Linear(in_features=32, out_features=1, bias=True)
  )
)

=== Epoch 1/3 ===
[Epoch 1] Batch 200/2344 - Loss: 1.3826
[Epoch 1] Batch 400/2344 - Loss: 0.8196
[Epoch 1] Batch 600/2344 - Loss: 0.8948
[Epoch 1] Batch 800/2344 - Loss: 1.3758
[Epoch 1] Batch 1000/2344 - Loss: 1.0881
[Epoch 1] Batch 1200/2344 - Loss: 1.2539
[Epoch 1] Batch 1400/2344 - Loss: 1.3091
[Epoch 1] Batch 1600/2344 - Loss: 1.3983
[Epoch 1] Batch 1800/2344 - Loss: 0.9961
[Epoch 1] Batch 2000/2344 - Loss: 0.7689
[Epoch 1] Batch 2200/2344 - Loss: 1.0601
[Epoch 1] Batch 2344/2344 - Loss: 1.1163
[VAL] Train Loss: 1.1046
[VAL] Accuracy@0.5:   0.5569
[VAL] ROC-AUC:       0.6449
[VAL] Classification report (thr=0.5):
              precision    recall  f1-score   support

         0.0     0.8946    0.5422    0.6752     40601
         1.0     0.1985    0.6395    0.3029      7198

    accuracy                         0.5569     47799
   macro avg     0.5465    0.5908    0.4891     47799
weighted avg     0.7897    0.5569    0.6191     47799

[INFO] New best val AUC: 0.6449 at epoch 1
[INFO] Saved confusion matrix to confusion_matrix_val_fast_epoch1.png

=== Epoch 2/3 ===
[Epoch 2] Batch 200/2344 - Loss: 1.3929
[Epoch 2] Batch 400/2344 - Loss: 1.2843
[Epoch 2] Batch 600/2344 - Loss: 1.2146
[Epoch 2] Batch 800/2344 - Loss: 1.3674
[Epoch 2] Batch 1000/2344 - Loss: 1.2324
[Epoch 2] Batch 1200/2344 - Loss: 0.9840
[Epoch 2] Batch 1400/2344 - Loss: 1.1639
[Epoch 2] Batch 1600/2344 - Loss: 1.7499
[Epoch 2] Batch 1800/2344 - Loss: 0.9989
[Epoch 2] Batch 2000/2344 - Loss: 1.1153
[Epoch 2] Batch 2200/2344 - Loss: 0.9949
[Epoch 2] Batch 2344/2344 - Loss: 1.0747
[VAL] Train Loss: 1.0936
[VAL] Accuracy@0.5:   0.6895
[VAL] ROC-AUC:       0.6759
[VAL] Classification report (thr=0.5):
              precision    recall  f1-score   support

         0.0     0.8979    0.7159    0.7966     40601
         1.0     0.2523    0.5408    0.3441      7198

    accuracy                         0.6895     47799
   macro avg     0.5751    0.6284    0.5704     47799
weighted avg     0.8007    0.6895    0.7285     47799

[INFO] New best val AUC: 0.6759 at epoch 2
[INFO] Saved confusion matrix to confusion_matrix_val_fast_epoch2.png

=== Epoch 3/3 ===
[Epoch 3] Batch 200/2344 - Loss: 1.2963
[Epoch 3] Batch 400/2344 - Loss: 0.8813
[Epoch 3] Batch 600/2344 - Loss: 1.1467
[Epoch 3] Batch 800/2344 - Loss: 1.3071
[Epoch 3] Batch 1000/2344 - Loss: 0.9277
[Epoch 3] Batch 1200/2344 - Loss: 0.9868
[Epoch 3] Batch 1400/2344 - Loss: 0.9197
[Epoch 3] Batch 1600/2344 - Loss: 1.1088
[Epoch 3] Batch 1800/2344 - Loss: 1.2090
[Epoch 3] Batch 2000/2344 - Loss: 1.2490
[Epoch 3] Batch 2200/2344 - Loss: 0.9382
[Epoch 3] Batch 2344/2344 - Loss: 0.9325
[VAL] Train Loss: 1.0837
[VAL] Accuracy@0.5:   0.5678
[VAL] ROC-AUC:       0.6762
[VAL] Classification report (thr=0.5):
              precision    recall  f1-score   support

         0.0     0.9103    0.5448    0.6817     40601
         1.0     0.2136    0.6973    0.3270      7198

    accuracy                         0.5678     47799
   macro avg     0.5619    0.6210    0.5043     47799
weighted avg     0.8054    0.5678    0.6283     47799

[INFO] New best val AUC: 0.6762 at epoch 3
[INFO] Saved confusion matrix to confusion_matrix_val_fast_epoch3.png

[INFO] Loaded best model with val AUC = 0.6762

[VAL] Threshold tuning on validation set...
[THR SWEEP] thr=0.10  acc=0.1506  bal_acc=0.5000
[THR SWEEP] thr=0.15  acc=0.1513  bal_acc=0.5004
[THR SWEEP] thr=0.20  acc=0.1539  bal_acc=0.5015
[THR SWEEP] thr=0.25  acc=0.1651  bal_acc=0.5079
[THR SWEEP] thr=0.30  acc=0.1981  bal_acc=0.5247
[THR SWEEP] thr=0.35  acc=0.2802  bal_acc=0.5614
[THR SWEEP] thr=0.40  acc=0.3820  bal_acc=0.5941
[THR SWEEP] thr=0.45  acc=0.4829  bal_acc=0.6161
[THR SWEEP] thr=0.50  acc=0.5678  bal_acc=0.6210
[THR SWEEP] thr=0.55  acc=0.6549  bal_acc=0.6188
[THR SWEEP] thr=0.60  acc=0.7569  bal_acc=0.6038
[THR SWEEP] thr=0.65  acc=0.8121  bal_acc=0.5644
[THR SWEEP] thr=0.70  acc=0.8339  bal_acc=0.5364
[THR SWEEP] thr=0.75  acc=0.8440  bal_acc=0.5118
[THR SWEEP] thr=0.80  acc=0.8489  bal_acc=0.5002
[THR SWEEP] thr=0.85  acc=0.8494  bal_acc=0.5000
[THR SWEEP] thr=0.90  acc=0.8494  bal_acc=0.5000
[INFO] Best threshold on val: 0.500 (balanced accuracy=0.6210)

[VAL] Metrics at best threshold:
    Best threshold:          0.500
    Accuracy:                0.5678
    Balanced accuracy:       0.6210
    ROC-AUC (unchanged):     0.6762
    Classification report:
              precision    recall  f1-score   support

         0.0     0.9103    0.5448    0.6817     40601
         1.0     0.2136    0.6973    0.3270      7198

    accuracy                         0.5678     47799
   macro avg     0.5619    0.6210    0.5043     47799
weighted avg     0.8054    0.5678    0.6283     47799

[INFO] Saved confusion matrix to confusion_matrix_val_fast_best_thr.png

[TEST] Evaluating on test set...

[TEST] Metrics at threshold = 0.5:
    Accuracy:          0.6114
    Balanced accuracy: 0.6551
    ROC-AUC:           0.7063
    Classification report:
              precision    recall  f1-score   support

         0.0     0.8919    0.5807    0.7034     51817
         1.0     0.3115    0.7295    0.4365     13474

    accuracy                         0.6114     65291
   macro avg     0.6017    0.6551    0.5700     65291
weighted avg     0.7722    0.6114    0.6483     65291

[INFO] Saved confusion matrix to confusion_matrix_test_fast_thr0.5.png

[TEST] Metrics at best val threshold (0.500):
    Accuracy:          0.6114
    Balanced accuracy: 0.6551
    ROC-AUC:           0.7063
    Classification report:
              precision    recall  f1-score   support

         0.0     0.8919    0.5807    0.7034     51817
         1.0     0.3115    0.7295    0.4365     13474

    accuracy                         0.6114     65291
   macro avg     0.6017    0.6551    0.5700     65291
weighted avg     0.7722    0.6114    0.6483     65291

[INFO] Saved confusion matrix to confusion_matrix_test_fast_best_thr0.50.png
Job finished at Thu Nov 27 00:50:39 MST 2025
